title,preview
Scientists Explore Outback as Testbed for Mars ,Australia provides a great place for NASA's Mars 2020 and the ESA-Roscosmos ExoMars scientists to hone techniques in preparation for searching for signs ancient life on Mars.
NASA Prepares for Moon and Mars With New Addition to Its Deep Space Network,Robotic spacecraft will be able to communicate with the dish using radio waves and lasers.
"NASA Wins 4 Webbys, 4 People's Voice Awards","Winners include the JPL-managed ""Send Your Name to Mars"" campaign, NASA's Global Climate Change website and Solar System Interactive."
NASA's Ingenuity Mars Helicopter Recharges Its Batteries in Flight,"Headed to the Red Planet with the Perseverance rover, the pioneering helicopter is powered up for the first time in interplanetary space as part of a systems check."
NASA's Perseverance Rover Will Look at Mars Through These 'Eyes',A pair of zoomable cameras will help scientists and rover drivers with high-resolution color images.
3 Things We've Learned From NASA's Mars InSight ,Scientists are finding new mysteries since the geophysics mission landed two years ago.
NASA Mars Mission Connects With Bosnian and Herzegovinian Town,"A letter from NASA was presented to the mayor of Jezero, Bosnia-Herzegovina, honoring the connection between the town and Jezero Crater, the Mars 2020 rover landing site."
Meet the People Behind NASA's Perseverance Rover,These are the scientists and engineers who built NASA's next Mars rover and who will guide it to a safe landing in Jezero Crater. 
NASA to Reveal Name of Its Next Mars Rover,"After a months-long contest among students to name NASA's newest Mars rover, the agency will reveal the winning name — and the winning student — this Thursday. "
MOXIE Could Help Future Rockets Launch Off Mars,"NASA's Perseverance rover carries a device to convert Martian air into oxygen that, if produced on a larger scale, could be used not just for breathing, but also for fuel."
A Year of Surprising Science From NASA's InSight Mars Mission,A batch of new papers summarizes the lander's findings above and below the surface of the Red Planet.
"NASA to Broadcast Mars 2020 Perseverance Launch, Prelaunch Activities","Starting July 27, news activities will cover everything from mission engineering and science to returning samples from Mars to, of course, the launch itself."
NASA-JPL Names 'Rolling Stones Rock' on Mars,NASA's Mars InSight mission honored one of the biggest bands of all time at Pasadena concert.
10.9 Million Names Now Aboard NASA's Perseverance Mars Rover,"As part of NASA's 'Send Your Name to Mars' campaign, they've been stenciled onto three microchips along with essays from NASA's 'Name the Rover' contest. Next stop: Mars."
Hear Audio From NASA's Perseverance As It Travels Through Deep Space,"The first to be rigged with microphones, the agency's latest Mars rover picked up the subtle sounds of its own inner workings during interplanetary flight."
